[
  {
    "id": "REF.HASHER.1977",
    "citation": "Hasher, L., Goldstein, D., & Toppino, T. (1977). Frequency and the conference of referential validity. Journal of Verbal Learning and Verbal Behavior, 16, 107–112.",
    "doi": "10.1016/S0022-5371(77)80012-1",
    "url": "https://doi.org/10.1016/S0022-5371(77)80012-1",
    "access_url": "https://hasherlab.psych.utoronto.ca/abstracts/hasher_etal_JVLVB_77.htm",
    "study_type": "EXPERIMENTAL",
    "checked_on": "2026-09-13",
    "review_scope": "ABSTRACT"
  },
  {
    "id": "REF.DECHENE.2010",
    "citation": "Dechêne, A., Stahl, C., Hansen, J., & Wänke, M. (2010). The truth about the truth: A meta-analytic review of the truth effect. Personality and Social Psychology Review, 14, 238–257.",
    "doi": "10.1177/1088868309352251",
    "url": "https://doi.org/10.1177/1088868309352251",
    "access_url": "https://methexp.uni-koeln.de/files/Dech%C3%AAne-Stahl-Hansen-W%C3%A4nke-2010.pdf",
    "study_type": "META_ANALYTIC",
    "checked_on": "2026-09-13",
    "review_scope": "ABSTRACT_AND_SELECTED_SECTIONS"
  },
  {
    "id": "REF.PENNYCOOK.2021",
    "citation": "Pennycook, G., Epstein, Z., Mosleh, M., Arechar, A. A., Eckles, D., & Rand, D. G. (2021). Shifting attention to accuracy can reduce misinformation online. Nature, 592, 590–595.",
    "doi": "10.1038/s41586-021-03344-2",
    "url": "https://doi.org/10.1038/s41586-021-03344-2",
    "access_url": "https://www.media.mit.edu/publications/shifting-attention-to-accuracy-can-reduce-misinformation-online/",
    "study_type": "EXPERIMENTAL",
    "checked_on": "2026-09-13",
    "review_scope": "ABSTRACT"
  },
  {
    "id": "REF.TOHIDI.2025",
    "citation": "Tohidi, A., Haider, S., & Watts, D. J. (2025). Rethinking news framing with large language models. Scientific Reports, 15, 45592.",
    "doi": "10.1038/s41598-025-29519-9",
    "url": "https://doi.org/10.1038/s41598-025-29519-9",
    "access_url": "https://www.nature.com/articles/s41598-025-29519-9",
    "study_type": "EXPERIMENTAL",
    "checked_on": "2026-09-15",
    "review_scope": "ABSTRACT_AND_SELECTED_SECTIONS"
  }
]
